,Round,Info Slide,Motion
0,ラウンド1,,"As feminists, this house supports all forms of self-commodification of one's sex appeal, escorting, sugardaddying / mommying, and starring in porn videos."
1,ラウンド2,,This house believes that Japanese feminists should advocate for the abolition of the Imperial system (天皇制) as opposed to advocating for the inclusion of female imperial members in the line of succession for the Imperial throne.
2,ラウンド3,"Misandry is the categorical hated for, contempt for, or prejudice against men or boys.
It includes but is not limited to overgeneralized criticisms, hate speech against men, discrimination in promotion opportunities etc",This house believes that women who have experienced gender based discrimination are justified in committing misandry.
3,Grand Final,"A Draft Lottery is a system in which citizens randomly selected by a lottery are conscripted to serve. While the term is commonly used for selective military conscription, a similar scheme is used for the selection of juries and lay judges (裁判員) in the court system.","This house, as the feminist movement, would advocate for the introduction of a socialized care system in which all people needing care (the elderly, people with disabilities, etc) are cared for by workers selected by a national draft system."
